{
  "has_form": true,
  "title": "Register",
  "purpose": "Creates a user account.",
  "fields": [
    {
      "key": "username", "label": "Username", "type": "text", "required": true,
      "format": "starts with a letter; 3–24 lowercase letters, digits or hyphens",
      "limits": { "pattern": "^[a-z][a-z0-9-]{2,23}$" }, "strategy": "native-input", "selector": "input[name=username]",
      "evidence": [{ "file": "lib/schemas.ts", "line": 12 }]
    },
    {
      "key": "email", "label": "Email", "type": "email", "required": true,
      "strategy": "native-input", "selector": "input[name=email]",
      "evidence": [{ "file": "lib/schemas.ts", "line": 13 }]
    },
    {
      "key": "country", "label": "Country", "type": "enum", "required": true,
      "options_from": { "load": "async", "pick_by": "text" },
      "notes": "searchable; type the name and pick it from the list",
      "strategy": "aria-combobox", "selector": "input[role=combobox][aria-labelledby=country-label]",
      "evidence": [{ "file": "components/CountryCombobox.tsx", "line": 18 }]
    },
    {
      "key": "newsletter", "label": "Email me product news", "type": "boolean",
      "strategy": "native-input", "selector": "input[name=newsletter]",
      "evidence": [{ "file": "app/(account)/register/page.tsx", "line": 16 }]
    }
  ],
  "submit": { "selector": "button[type=submit]", "label": "Register", "success": {} },
  "rules": [],
  "gotchas": [],
  "questions": [{ "text": "What does the page show after a successful registration?" }]
}
